{
  "type": "object",
  "properties": {
    "title": {
      "type": "string",
      "minLength": 1
    },
    "company": {
      "type": "string",
      "minLength": 1
    },
    "description": {
      "type": "string",
      "minLength": 1
    },
    "location": {
      "type": "string",
      "minLength": 1
    },
    "work_mode": {
      "enum": [
        "remote",
        "hybrid",
        "onsite"
      ]
    },
    "requisition_id": {
      "type": "string",
      "minLength": 1
    },
    "apply_url": {
      "type": "string",
      "minLength": 1
    },
    "source": {
      "type": "string",
      "minLength": 1
    },
    "clearance": {
      "type": "string",
      "minLength": 1
    },
    "salary": {
      "type": "object",
      "properties": {
        "min": {
          "type": "number",
          "minimum": 0
        },
        "max": {
          "type": "number",
          "minimum": 0
        },
        "currency": {
          "type": "string",
          "minLength": 1
        }
      },
      "required": [
        "min",
        "max",
        "currency"
      ],
      "additionalProperties": false
    }
  },
  "required": [
    "title",
    "company",
    "description",
    "location",
    "work_mode"
  ],
  "additionalProperties": false,
  "$schema": "https://json-schema.org/draft/2020-12/schema"
}
